{
  "request_id": "PLAN-PHY-RELATIVE-MOTION-NCERT-CURRENT",
  "subject": "Physics",
  "subtopic": "Relative motion",
  "requested_cores": [
    "CORE1",
    "CORE2",
    "CORE1A",
    "CORE1B",
    "CORE2A",
    "CORE2B"
  ],
  "source_basis": [
    "https://ncert.nic.in/textbook/pdf/keph103.pdf"
  ],
  "source_receipt_ref": "SRCREC-NCERT-KEPH103-RELATIVE-MOTION-2026-09-18"
}
